{
  "schema_version": "eusp-action/v1",
  "synthetic": true,
  "fixture_notice": "This is a fabricated, anonymized public evaluation fixture. It contains no real person, contact, relationship, permission, or contact route.",
  "snapshot_date": "2026-08-30",
  "timezone": "Etc/UTC",
  "evidence": [
    {
      "id": "e-guide",
      "claim": "The fictional call provides a public applicant guide.",
      "quote": "Example Civic Lab provides a public applicant guide for the 2026 call.",
      "url": "https://example.test/civic-lab/call",
      "retrieved_at": "2026-08-30T10:00:00+00:00",
      "source_type": "official_primary",
      "entailment": "direct",
      "supports": ["a-guide-checklist"],
      "purpose": "action_basis"
    },
    {
      "id": "e-orientation",
      "claim": "The fictional public orientation names a topic shared by its working-group participants.",
      "quote": "The public orientation gives every working-group participant the same civic-data topic for the next session.",
      "url": "https://example.test/civic-lab/orientation",
      "retrieved_at": "2026-08-30T10:05:00+00:00",
      "source_type": "official_primary",
      "entailment": "direct",
      "supports": ["a-orientation-question-draft"],
      "purpose": "verified_shared_context"
    }
  ],
  "actions": [
    {
      "id": "a-guide-checklist",
      "classification": "ACT_NOW",
      "kind": "local_artifact",
      "action": "Extract the public applicant-guide requirements into a checklist.",
      "deliverable": "A one-page local requirements checklist.",
      "start_date": "2026-08-31",
      "minutes_min": 20,
      "minutes_max": 35,
      "blockers": ["Whether the user's existing materials meet every requirement remains unknown."],
      "evidence_ids": ["e-guide"]
    },
    {
      "id": "a-orientation-question-draft",
      "classification": "PREPARE_NEXT",
      "kind": "cold_outreach_draft",
      "action": "Draft one concise question about the public orientation topic.",
      "deliverable": "A local, unsent outreach draft for the user's review.",
      "start_date": "2026-08-31",
      "minutes_min": 15,
      "minutes_max": 25,
      "blockers": ["The user must independently decide whether, where, and to whom any later external act is appropriate."],
      "evidence_ids": ["e-orientation"],
      "draft": {
        "text": "Hello,\n\nI am preparing a concise question about the civic-data topic in the public orientation. Is there public material that explains the next session?\n\nThank you.",
        "shared_context": {
          "profile_field_id": "asset-1",
          "provenance": "user_supplied",
          "evidence_ids": ["e-orientation"]
        }
      }
    }
  ]
}
